tweet_content,retweet_count,favourite_count,tweet_id,tweets_Id
"A foodie cover of Jay-Z’s “99 Problems.” Pockets full of cheddar, ya’ll …","99","86","337025074500624384",0
"[LIVE] Improv masters from the Upright Citizens Brigade Theater do comedy based on your videos.","66","54","337009974532243458",0
"Enter the  time machine.","45","43","336994889533370369",0
"What do your insides look like? Ask Dr. Good.","69","50","336980298036297728",0
"Hannibal Buress, Skrillex and Ryan Phillippe tear the house down for  . Rappity rap!","92","66","336964712006836224",0
"all-stars Tim and Eric get super serious for a smooth-jazz song about facial hair.","73","57","336949592476237824",0
"soul man  performs his super meaningful “Dramatic Song.”","87","81","336934505677979649",0
"Come see the daily rundown of  videos with  and :","69","66","336922009613266945",0
"makes his first  response to a video about life hacks by suggesting some of his own -&gt;","46","39","336876700703006720",0
"If you don't watch this  video from , you won't know what everyone's talking about:","135","104","336692910407958529",0
"LIVE NOW: It's Macklemore &amp; Ryan Lewis. Time to put your hands up.","115","102","336655516015136768",0
"Great comedians, great cause. 's International Stand Up Night is live in 30 minutes.","114","82","336640193476059136",0
"FOMO the Horror Movie—because nothing is scarier than missing out ...","89","76","336625040013545472",0
"Upload your  and join  in the  shenanigans.","70","53","336602551464108033",0
""The Office"'s David Brent teaches us all how to play guitar.","109","99","336576282303295488",0
"Today we turn 8, but what if YouTube was actually over 2000 years old?","302","226","336547837754105857",0
"Where else can you see Skrillex battle Mozart?","25","13","336316319983079424",0
"We're glad you think so. And, you're welcome.","5","3","336316262303014914",0
"No one's getting past those two.","26","85","336316190064533504",0
"An Internet trend is born. Upload your  to get on board.","107","89","336314407036518400",0
"Everyone say thanks to  for 100 years of surf 'n turf.","75","70","336311124381274113",0
"inspired us to get a Tumblr. Stay tuned for a steady stream of awesome:","73","84","336309200516952065",0
"So, whose side are you really on?  or ?","81","75","336304702247555074",0
". is having a perfect  night. Retweet if you are too.","85","47","336303374150553600",0
"“The Holy Trinity of Hip-Hop,” aka Three Loco takes the stage right now. Neat-o.","58","39","336301025063473152",0
"Are  going to spoil ?","51","58","336294885646811137",0
"We’re having a cute-off. Retweet if you think  should win.","87","42","336293672431792129",0
"You've earned it. Kill it out there.","16","37","336291687418699777",0
"Thanks! We're actually flattered.","14","42","336291616589508608",0
"Get your towels ready. It’s about to go down.  is spring breakin’ on a boat ...","70","53","336287601055125504",0
"Uh oh. Did Sarah Silverman go too far? Tell us:  or","53","76","336286506627002369",0
"LIVE NOW. YouTube's Big Live Comedy Show. The most significant event in the history of anything ... EVER.","214","147","336285285010784256",0
"We can't wait either!","3","0","336279969556750336",0
"Nice.","3","2","336279903743901697",0
"You looked good. Where'd you get those shoes?","107","165","336279492194615296",0
"[LIVE] The Show Before The Show starts now.","88","73","336270324779843584",0
"Hide your kids. Due to excessive awesomeness (and adult themes), our  live show is 18+ only.","140","137","336266878416736256",0
"Us too, man. No pressure.","1 time\n  \n\"\n      \u003E\n        \n          \u003Cstrong\u003E1\u003C\/strong\u003E Retweet\n          \n              \u003C\/a\u003E\n    \u003C\/li\u003E\n\n    \u003Cli class=\"js-stat-count js-stat-favorites stat-count\"\u003E\n      \u003Ca tabindex=\"0\"\n          class=\"request-favorited-popup\"\n          data-activity-popup-title=\"\n  \n  Favorited 3","3","336258380731666432",0
"Such a baller.","1 time\n  \n\"\n      \u003E\n        \n          \u003Cstrong\u003E1\u003C\/strong\u003E Retweet\n          \n              \u003C\/a\u003E\n    \u003C\/li\u003E\n\n    \u003Cli class=\"js-stat-count js-stat-favorites stat-count\"\u003E\n      \u003Ca tabindex=\"0\"\n          class=\"request-favorited-popup\"\n          data-activity-popup-title=\"\n  \n  Favorited 7","7","336258296514232320",0
"The Big Live Comedy Show will go LIVE in one hour. Get your last fake laugh out while there’s still time.","127","71","336255102455255041",0
"How'd you get our mom's number?","9","12","336240145852411905",0
"Quite possibly the funniest 20 seconds in history.","40","81","336240057532964864",0
"We're all about bringing together besties.","1 time\n  \n\"\n      \u003E\n        \n          \u003Cstrong\u003E1\u003C\/strong\u003E Retweet\n          \n              \u003C\/a\u003E\n    \u003C\/li\u003E\n\n    \u003Cli class=\"js-stat-count js-stat-favorites stat-count\"\u003E\n      \u003Ca tabindex=\"0\"\n          class=\"request-favorited-popup\"\n          data-activity-popup-title=\"\n  \n  Favorited 2","2","336214732723855361",0
"It's gonna be epic.","11","17","336214614528389121",0
"Blast off is at 5pm. So psyched.","16","28","336214549101441024",0
"You're always welcome to the party.","1 time\n  \n\"\n      \u003E\n        \n          \u003Cstrong\u003E1\u003C\/strong\u003E Retweet\n          \n              \u003C\/a\u003E\n    \u003C\/li\u003E\n\n    \u003Cli class=\"js-stat-count js-stat-favorites stat-count\"\u003E\n      \u003Ca tabindex=\"0\"\n          class=\"request-favorited-popup\"\n          data-activity-popup-title=\"\n  \n  Favorited 6","6","336214491480084480",0
"All the cool kids will be there tonight.","24","24","336214383325753344",0
"Did someone say "awesome"? We're so there.","2","7","336214309275328513",0
"You did it, so give us a ring: 1-888-303-3771.  will be a good time.","135","124","336192736485060609",0
"We never joke about .","4","5","336180288377991168",0
"Great shot. We love seeing your pics.","1 time\n  \n\"\n      \u003E\n        \n          \u003Cstrong\u003E1\u003C\/strong\u003E Retweet\n          \n              \u003C\/a\u003E\n    \u003C\/li\u003E\n\n    \u003Cli class=\"js-stat-count js-stat-favorites stat-count\"\u003E\n      \u003Ca tabindex=\"0\"\n          class=\"request-favorited-popup\"\n          data-activity-popup-title=\"\n  \n  Favorited 3","3","336180159793221634",0
"Only six hours left until our BIG, LIVE  kick-off show. It’s gonna be … "exquisite."","116","87","336180119028785152",0
"Red is your color. Ready for ?","0","0","336180094823444480",0
"Looking good. Ready to be funnier than ever?","3","8","336179944294080512",0
"all-stars  unveil their summer plans.","113","95","336013458053156865",0
".’s mischievous BearShark duo devises an elaborate plan for world domination.","86","70","335983225652514816",0
"We know what you want for : A good time. If we get 1,000 retweets we'll give you our number.","1,178","144","335932305631760384",0
"The countdown to  has begun. In 24 hours you will watch the biggest and livest comedy show EVER.","158","100","335907796145041408",0
"Well, we hope it's funny. Otherwise we're just a bunch of jerks.","3","5","335903787644497920",0
"Feast your eyes upon the awesomeness of pop-culture artifacts from the past.","91","71","335892639809409025",0
"’s resident fruit  battles villains in an effort to rid the world of bad apples.","73","67","335862435628085250",0
"About to rehearse for Comedy Week Live. This place be cray","106","247","335819569144938496",0
"We forgive you, Dan. Hug?","218","502","335832843936755712",0
".’s Kid President revisits the distant past in episode two of his “Classics” series.","66","82","335832252497936384",0
"Found it!","57","51","335825641645686784",0
"That's why we created this space, to bring people from all over to come together and enjoy popcorn.","537","1,402","335825540269355008",0
"Smooth face = smooth rhymes. Gotta be at your best for .","6","4","335825490029993986",0
"A new Asian-American variety show starring ’s Kevin Jumba, Freddie Wong and others.","101","92","335802052594769921",0
"duo  subject children to the “Rude Wake Up Prank.”","129","110","335666142733557761",0
"Never give a thumbs-up in Iran and other tips for world travelers fond of gesticulating.  (via )","179","140","335620843872858113",0
"star  imagines a future dystopia in which dogs have annihilated every cat save one.","104","70","335590643311202304",0
"For every RT, we'll pledge 1 minute of hilarity during . Please RT. This needs to be funny.","1,238","121","335560452765536257",0
"I think you are missing a pin?","7","10","335515989288566784",0
"Is that blue steel?","2","2","335515929330999296",0
"Beautiful shot. You're making us feel ... feelings.  not .","6","20","335515795180384256",0
"Seems legit.","0","0","335515761793703937",0
"I bet if Will finished his set, he would have made  laugh. Tell us the joke you didn't tell him.","0","0","335514471739031552",0
"Animals speaking and screaming like humans.  (via )","186","118","335496465696841729",0
"You gotta be funny and last all night. No pressure.","24","14","335171304669970432",0
"comedian Craig Robinson has some super sexy advice for potential lovers.","68","75","335167865793695744",0
"Careful with the sideburns. They could be the source of your funny.","5","7","335165952507404290",0
"Whatever you decide, we're sure it'll be awesome. It has to be.","4","12","335165740913152001",0
"We're watching Three Stooges to stay on the cutting-edge of comedy. What are you up to?","1 time\n  \n\"\n      \u003E\n        \n          \u003Cstrong\u003E1\u003C\/strong\u003E Retweet\n          \n              \u003C\/a\u003E\n    \u003C\/li\u003E\n\n    \u003Cli class=\"js-stat-count js-stat-favorites stat-count\"\u003E\n      \u003Ca tabindex=\"0\"\n          class=\"request-favorited-popup\"\n          data-activity-popup-title=\"\n  \n  Favorited 7","7","335165640195338240",0
"Things are getting real.","2","6","335165260552101888",0
"Will the FridgeCam solve all of our problems?","3","3","335165168948494336",0
"Joining forces for ...or world domination?","8","9","335165026119847937",0
"A collection of finale teasers and bittersweet farewells from your friends at .","71","80","335152770980118531",0
"star  reviews Avril Lavigne’s latest video.","89","79","335137679714951169",0
"To prep for the Social Star Awards on May 23, Harley from  masterminds a ludicrous montage.","68","52","335122594854477826",0
"Can you guess which one of these commercials is real and which are  spoofs?","65","72","335107545825947649",0
"RT &amp; Fill in the blank: I'm most excited to see ____ at .","85","45","335078066500022272",0
"A playlist of hilarity to get you stoked for our Big Live  show starting May 19 at 5 p.m. PT.","111","93","334771634164625408",0
"Definitely funny. Hahahaha. Hahahahahaha.","16","8","334725316113223680",0
"Laughing is funny!   &amp; me","149","164","334715424900005888",0
". is back for a super official review of McDonald's new Egg White Delights.","92","78","334465754328084480",0
"Oh, just a run-of-the-mill rap about a giant robot made of rhinoceroses. Nothing weird to see here.","86","79","334450644297580544",0
"Hasta la vista, babies, and thanks for all the awesome submissions.  has left the building.","109","83","334431754616197121",0
".  My favorite. I can't stop laughing. I hope his head is OK.","67","63","334427022354968576",0
". What does the Commando of Comedy have to say about  ’s eat-like-animals pick?","98","73","334419813764063232",0
".   It doesn't fit my fitness message, but I admit, it does pull the heart strings... Hilarious.","78","101","334415376232378369",0
"And how about  ’s vote for  's video: . Does it pass the  test?","61","52","334411952694628353",0
"Good effort. “: So  thinks this viral classic is hilarious. . What do you say ?”","62","44","334410978060029952",0
"So  thinks this viral classic is hilarious. . What do you say ?","58","53","334408690646020096",0
"Tweet us your favorite funny video or photo for a chance to have it rated by our  expert, Arnold .","104","66","334396900331618304",0
"Be the coolest kid in class or at the office with this musical ruler.","129","85","334381032352665600",0
"Sarah Silverman has a torrid (and very French) love affair with an unlikely fella in “Fête des Pets.”","97","80","334141101894164480",0
"Arnold  is here to pump you up for .","287","178","334132072618811393",0
". Don't you mean "pumped up?"","82","102","334131813150773248",0
"A super smart rap about subjective reality.","87","87","334110889324195841",0
"An intimate unboxing of Daft Punk’s new album, “Random Access Memories.”","199","107","334095803968802820",0
"A crowdsourced dare results in a dude putting ice down his pants.","120","182","334080699701268480",0
"Energetic puppets discuss the perils and pitfalls of time travel.","89","59","334065606515118080",0
"Learn to shred like a pro with madman guitarist David Brent from “The Office.”","108","74","334047040688513026",0
"Boom shakalaka.","11","13","334024725577756673",0
"He looks like he's about to do something incredibly funny.","3","6","334024542269865986",0
"An elaborate prank from Jay Leno results in an impromptu karaoke session of epic proportions.","299","176","333657923983126529",0
"A smooth remix of Zooey Deschanel’s crazy love antics on “New Girl.”","167","159","333642821049405440",0
"The best of the latest YouTube trend “Acting Like Animals.”","108","91","333628569060265984",0
"A  message for moms across the land from the always adorable Kid President.","392","187","333612683695902720",0
"A special “Yo Momma” joke battle for . (via )","226","188","333295524784533504",0
"A subtly glamorous contribution to the  soundtrack by Lana Del Rey:","169","151","333280427638923265",0
"Nick Offerman is back for another round of reading tweets from young female celebrities.","112","97","333265507916591106",0
"An epic fan video honoring ten years of trying stuff you shouldn’t try at home with the .","269","248","333250232114626560",0
"Mariah Carey gets up close and personal with a vintage motorcycle in  ft. Miguel.","313","141","333046371730997249",0
"What your tweets say about you.","169","150","333023733335859200",0
"SCIENCE.","8","6","333002602839175168",0
"How to get women to notice you using the wisdom of pop stars present and past.","102","99","332935695159156736",0
"Put your  at ease. The top trending YouTube videos of the week are in:","60","68","332925592230064128",0
"Dab a dab on your wrist, ladies can’t resist. Introducing Pool Water Cologne from Ryan Lochte.","69","73","332910494191087616",0
". gets his 20s swag on during a performance of his hit “Bang Bang” from  soundtrack.","98","81","332896592703152128",0
"Hey, guys. We'd like to get in touch. Follow &amp; DM so we can connect.","2","3","332895185593851905",0
"Hey, Danny. We'd like to get in touch. Follow &amp; DM so we can connect.","4","5","332895052164644864",0
"Hey, Miss P. We'd like to get in touch. Follow &amp; DM so we can connect.","0","0","332894745326129152",0
"Avril Lavigne gets gothy at prom in the new video for her party anthem, “Here’s To Never Growing Up.”","510","240","332882800611053568",0
"Enter a closet of fairy tales and magic with comedians  and Mike O’ Brien.","103","78","332714190357819392",0
"Hey, Jack. We'd like to get in touch. Follow &amp; DM so we can connect.","3","3","332683262579318784",0
"An electro medley with b-boy flair from from swing-hop outfit Menage Quad.","81","77","332676429064065024",0
"If you could rename your microwave, what would you call it? A snack sauna, maybe?","149","93","332648748914204672",0
"Seeing a weird banner in your search results? No worries-fix in the works. Nothing juicy to see here!","279","136","332583914818379776",0
"Get your “Great Gatsby” on with this 1920s inspired jam from .","110","95","332577041075535872",0
"New ways to support great content on YouTube.","148","82","332572248730898432",0
"An “Iron Man” parody of Justin Timberlake and Jay-Z’s “Suit &amp; Tie.” Guess what it’s called.","480","284","332540563532439552",0
"The top 5 songs for the moms:  (via ) .","146","107","332527321087082496",0
"Four-year-old soul man Kai Langer returns to  for another adorable Bruno Mars cover.","289","199","332284029976064000",0
"The Wanted gives a nod to boy bands of yesteryear in their latest video, “Walks Like Rihanna.”","147","87","332269582419116033",0
"You're so beautiful. Love you too, man.","23","19","332263354125135876",0
"A playlist of some of the most epic prom proposals on YouTube.","102","87","332240366403215361",0
"Explore the most popular videos across the U.S. with our new Trends Map.","100","77","332223470027038720",0
"Well he is a dreamboat. You're welcome.","3","4","332204118636650496",0
"Yep. Less than two weeks to figure out how to be the funniest thing on the internet. Any ideas?","1 time\n  \n\"\n      \u003E\n        \n          \u003Cstrong\u003E1\u003C\/strong\u003E Retweet\n          \n              \u003C\/a\u003E\n    \u003C\/li\u003E\n\n    \u003Cli class=\"js-stat-count js-stat-favorites stat-count\"\u003E\n      \u003Ca tabindex=\"0\"\n          class=\"request-favorited-popup\"\n          data-activity-popup-title=\"\n  \n  Favorited 5","5","332203906979463168",0
"Selena Gomez channels the energy of the four elements in her latest video, “Come and Get It.”","436","209","332202635060994048",0
"Two guys bang out an epic tribute to Pink on a shared keyboard and drum set.","224","182","331936569634205696",0
"Walk off the Earth invites you into a house of piggy banks for a bubbly cover of Madonna’s “Material Girl.”","151","128","331921467669348354",0
"Thanks,  is sure to be a feast.","10","6","331896801982570497",0
"No pressure. Just be funnier than you've ever been before.","3","10","331896612525842434",0
"The love runs deep, guys. Well, as long as you bring the funny.","13","22","331896341603160066",0
"A  trailer welcoming you to the most culturally significant event ever ...","147","89","331878022825267200",0
"Thanks for all your guesses, everyone. And now, the cast of our  trailer.","187","287","331871673940848641",0
"Yep, it’s . Any more guesses before we reveal the rest?","191","137","331867374468874241",0
". got , but can she guess which  star is the comedy heroine of ?","86","94","331862116023824384",0
"Yup, Rainn Wilson co-created Soul Pancake with Joshua Homnick and Devon Gundry.","4","0","331860723481321473",0
"You're so close. Who created Soul Pancake? Keep guessing!","1 time\n  \n\"\n      \u003E\n        \n          \u003Cstrong\u003E1\u003C\/strong\u003E Retweet\n          \n              \u003C\/a\u003E\n    \u003C\/li\u003E\n\n    \u003Cli class=\"js-stat-count js-stat-favorites stat-count\"\u003E\n      \u003Ca tabindex=\"0\"\n          class=\"request-favorited-popup\"\n          data-activity-popup-title=\"\n  \n  Favorited 2","2","331858621686222848",0
"Props to  for knowing her Daily Grace. Hint 2: This -er wants to feed your soul with pancakes.","72","116","331857717750796288",0
"She's definitely a comedian. Keep the guesses coming.","2","0","331848769433907202",0
"Guess the  star to reveal who's behind the shadows. Hint 1: she posts a video of herself every day.","103","100","331847958448455682",0
"The crazier the better, right? That looks like the dream team right there.","4","6","331834671233122305",0
"See you back at the mothership.","0","0","331834350758920192",0
"Tim McGraw, Taylor Swift and Keith Urban sing of losing love to the road in “Highway Don’t Care.”","265","158","331566624693972992",0
"Iggy Azalea nods to Bollywood and urges you to shake it in her latest video, “Bounce.”","88","74","331551528852795392",0
"Harry Potter reveals all in his contribution to the “Draw My Life” trend.","431","283","331539757425373184",0
"No doubt you'll have us in stitches, Olga. Oh, and high five  for us?","2","10","331537466475552768",0
"It's a clever strategy. You have to let us know if things work out better for you than they did for .","6","6","331503401420591104",0
"Ed Sheeran love lyrics tested on real live girls.","196","197","331498677199847426",0
"If you keep making that stank face, it's going to get stuck.  (via )","81","59","331484265852321793",0
"Road rage isn't the only thing captured by dashboard cameras.","496","268","331166489208041472",0
"Eating apples from bottom to top. This changes everything.","206","160","331121196030640129",0
"A glance at navigating Google Glass.","278","172","331075950538289153",0
"Just in case you've been living under a rock this month.","171","145","330826740228313088",0
"A costume guide for May the 4th... this is. Dress up... you will.","109","97","330804104391692288",0
"Seventeen rants. Four angry minutes.","113","119","330781446576943105",0
"Area man throws in towel after 10,000 tweets. (via )","110","85","330758816092258304",0
"So your buddies want to go see Iron Man 3, but you didn't see the first two? No problem.","573","320","330736151310761986",0
"Rare footage of the introvert in his natural habitat.","158","155","330713515155402753",0
"YouTube Capture makes uploading videos to  super easy &amp; it just got even better! Check out the new release:","141","119","330062753937121281",0
"Yes! Can't wait to see you and the  crew kill it at . Thanks for the s/o.","9","12","330458226766266368",0
"Oringally famous for her eyebrow tricks, Sarah Ellen is back with another funny talent.","155","121","330456807497682944",0
"Our new  content is here! Check out interviews with  of  + :","51","40","330426546722578433",0
"Aww, what a nice couple.","279","149","330434159673765888",0
"Epic history or epic bacon?  has both.","78","58","330411520456544256",0
"A proper cover of Daft Punk's new single "Get Lucky."","319","246","330391517418119168",0
"YEAH! Get into it, Adam! It's going to be super awesome.","7","2","330367582836236288",0
"Thanks, Shira. Hope you're as pumped as we are!","2","0","330366599729139713",0
"Maybe for now, we'll see how things shake out by the end of .","44","66","330129690142588930",0
"Who's going to win ? Who else.","105","86","330107897545637889",0
"A stop-motion film made of single atoms. Because even nanophysicists need to have a little fun.","297","206","330079325330223104",0
"Hand to foot to hand to slam dunk. An alley-oop like you've never seen.","205","122","330056676940070913",0
"The average person spends 20,160 minutes of their life kissing. Want to know why?","189","128","330030248026599424",0
""Nashville" stars Lennon and Maisy Stella melt hearts at the Grand Ole Opry.","191","129","330005090721202176",0
"WUB WUB WUB WUUUB. Marquese Nonstop Scott bends a few laws of physics with his dance to "Broken Strings."","169","126","329716933920428032",0
"Learn how a T-Rex eats and much more with this "humans acting like animals" playlist. Science.","103","109","329701837303316481",0
"No need to pay attention while you're texting; these seeing-eye people will watch out for you.","176","135","329681693994786816",0
"Italian singer Arianna gets nautical with Pitbull &amp; Charlie Sheen in “Sexy People (The Fiat Song).”","195","140","329392283734646786",0
"Commuters, take a second to check out buskers on the train. You might just get Bubléd.","136","88","329377190582038528",0
"A camel's diet consists of seeds, leaves, desert plants, and ... human children? Bad camel!","200","98","329359794387439616",0
"Think long and hard about National Honesty Day with a playlist about why we lie.","120","91","329331900873338882",0
"Former street perfomers wow the audience at Britain's  with their rendition of "Hurts So Good."","131","110","329287697145417728",0
"supergroup SHINee urges us to loosen up in their new video “Why So Serious.”","270","185","329037452725604353",0
"You'll never guess who Spielberg cast to play Obama.","334","165","329005453554089987",0
"In case you missed the live stream, here’s ’s first ever performance of “Gentleman.”","142","112","328977051677782016",0
"[LIVE]  performs from her debut album at  Space L.A.:","133","102","328954402561982465",0
"Scenes from “Game of Thrones” acted out by a little girl and her puppets.","121","102","328931841518227456",0
"More , now on :","86","59","328919182978723840",0
""I'm just going to walk into Mordor this afternoon."","158","158","328629765252722689",0
"“The Great Gatsby” gets audited by the tax man.","132","96","328599575009058816",0
"Australian pop star  crushes on a girl with pretty brown eyes in his latest video.","1,156","827","328569370802544641",0
"Take a trip to South Africa to sample the high life with Talib Kweli and friends.","140","100","328297580469555200",0
"A funky jam about a bunch of experiences you may or may not relate to.","99","96","328252290291077123",0
"Master cover artist Tyler Ward takes on PSY’s “Gentleman.”","149","135","328222087510630400",0
"Ellen interviews herself on . Super meta ...","201","160","327889909165727744",0
"Get hyped for the weekend with David Guetta’s latest video “Play Hard” ft. Akon and Ne-Yo.","177","122","327874804902412288",0
"Gerard Butler takes the hidden-camera prank genre to unexpected new heights.  (via )","112","116","327858854362746880",0
"A vintage “Great Gatsby"-style cover of Swedish House Mafia’s “Don’t You Worry Child.”","219","162","327844269505269760",0
"A collection of pranks for the next time you hit up the drive-thru.","123","120","327829595674001408",0
"Student Affairs reveals un-awesome weekend plans.  (via )","114","59","327548407092760576",0
