tweet_content,retweet_count,favourite_count,tweet_id,tweets_Id
"Chicago... we're playing Subterranean tonight.  RT this for a chance to win guest list!","0","0","230336113556987904",0
"Thank you for coming out!  We'll see you again soon enough.","0","0","230017220120547328",0
"If you're in Nashville, and not going to see Snowden play at High Watt tonight, may God have mercy on your soul.","0","0","229714024525332480",0
"Hey Nashville... we're playing at The High Watt with  tonight.  You don't really need to go to bed early tonight.","0","0","229729895956221952",0
"going to corndogarama at the earl tonight to see Snowden. check the new video/single:","0","0","229297963690758144",0
"Currently on the road to Atlanta.  Can't wait to be back in our old home and see all our friends.","0","0","228939893483646976",0
"► Video: , ‘The Beat Comes’","0","0","228918614361784320",0
"hey... could you hit us up via DM?","0","0","228624438759915521",0
"Chapel Hill:  If you'd like a chance to win guestlist for tonight's show RT this!","0","0","228543810303565824",0
"Hey Dani... you're on our guest list +1 for the show at DC9 tonight!  We're supporting on this one, so come early!","0","0","228225524558876672",0
"consider yourself followed!  hit up Shira - shira@bighassle.com","0","0","228200073534779392",0
"check your DM","0","0","228193208864210944",0
"Thanks Electra!","0","0","228192666142261248",0
"Music Video - Snowden - The Beat Comes  via","0","0","228185703991869440",0
"DC: We're playing tonight before The Growlers at . Re-tweet this for a chance to get on our guest list for the show!","0","0","228146514239836163",0
"Hey... you've got yourself +1 on our guestlist for tonight at @themercuryloungeny.  See you there!","0","0","227862497162563584",0
"New York:  We're giving away two tickets for tonights show .  RT this and if we respond, you're on our list!","0","0","227825234655453185",0
"New York:  Come celebrate the release of the new single and video with us Tuesday night  : Tickets at","0","0","227561362392481792",0
"@vhsRobot We're not playing at noon... we're playing at 11:30pm-12:30am at Corndogorama.","0","0","227553903309385729",0
"WATCH: 's new vide for “The Beat Comes” continues indie rock's disturbing dearth of good dads","0","0","227527923878486016",0
"Check out the latest video I directed for Snowden on Sterogum - "The Beat Comes" -   Thanks!","0","0","227501941465440256",0
"Our new video just debuted on Stereogum! " Snowden return with a new video - "The Beat Comes" "","0","0","227498043958767616",0
"Atlanta... Someone go with this guy RT   Someone please come to the  show with me at The Earl this Saturday!","0","0","227474057849876480",0
"The video for The Beat Comes debuts today on one of our favorite sites.  Keep an eye out around 2pm.","0","0","227433174513373185",0
"Final touches are being put on the video for The Beat Comes.  Should have it out for you guys next week!","0","0","226112412036771841",0
"RT: Doing a giveaway for   at @mercuryloungenyc on Tuesday - comment on our post on  to win!","0","0","225741040164950018",0
"@rtc44 Hahahah... they do, but they don't get shut out of venues due to age.   Just making sure no one gets left out.","0","0","225648179150983169",0
"Looking forward to Corndog-o-Rama at  July 28th &amp; 29th.      etc.","0","0","225638879858921473",0
"Can we get a show of hands... How many of you guys are under 21?  If you could see us play a venue in your town where would it be?","0","0","225638894253772800",0
"New single "The Beat Comes" on Sound Cloud now!    Mini-tour starts next week.","0","0","225352167563870209",0
"Just got back the first of a bunch of remixes that are being completed this week.   did a great job.","0","0","219844368775909376",0
"@theglasslands 10pm","0","0","218873742787481600",0
"Snowden &amp; We Can't Enjoy Ourselves (Record Release Show!) @theGlasslands tonight!","0","0","218767063131496449",0
"Snowden makes a welcome return to Glasslands on June 29th with We Can't Enjoy Ourselves!","0","0","214747653177741312",0
"If you like us and think your friends might like us too, please RT this so they can follow us.  We always like new friends.","0","0","213419110669889537",0
"@rtc44 Thanks!  Anemone Arms will definitely be on the new album.","0","0","212762812345368577",0
"at  7/24 $10 presale Wed at noon:","0","0","209382677109944320",0
"We've got lots of things coming in July.  Single, video, remixes, and 9 east coast dates.  Album and national tour in the fall.","0","0","212309308187222016",0
"Brooklyn, we're coming back to play a show at Glasslands on June 29th.  You can get $10 advance tickets online.","0","0","211897079038087170",0
"If anyone in the Atl area is looking to rent/buy a house with a studio buildout hit me up! Moving to LA when I get back to the states.","0","0","201687249690177537",0
"Wow.","0","0","201735430469730304",0
"can't wait to hear this remix!","0","0","201674744133713920",0
"@wesgrant88 just announced. Hits in the fall!","0","0","200080359306690561",0
"And check out my labelmates at  . Big thx to","0","0","198814368920641536",0
"Finally. Thx to  's new label my record arrives this fall. Lookout for singles/vids/tours soon.","0","0","198794938631200769",0
"This is the best promo I've ever seen","0","0","190220331926036480",0
"we're cheap. Book the flights.","0","0","189423569695031296",0
"put this in your GTO and smoke it","0","0","188082128083365888",0
"awww...I miss Atlanta. Believeitornot, I really miss the trees. So weird.","0","0","185245538051047425",0
"same to you!","0","0","180768040684756993",0
"my liver quivers in antici....pation.","0","0","180372223939452929",0
"our only public SXSW play is Friday night, 11pm, Hotel Vegas outdoor stage.","0","0","179674716833976322",0
"So good to visit NYC. Apparently  was at Glasslands. Who says all our fans are reclusive, melancholic dudes?","0","0","169846793536937984",0
"Whoa. Totally forgot about Boards of Canada. Mind blown all over again -","0","0","165345508150349824",0
"One of the greatest pieces in the world. 12 mins of bliss. Gustav Mahler -  via","0","0","164232760532279296",0
"Don't know how I missed this gem. Austin natives,13th Floor Elevators -  via","0","0","161993879162331137",0
"A very happy bday to Snowden guitarist David P. Fortunate to have you in my life.","0","0","161304337979678720",0
"LCD Soundsystem's finale as a documentary. Looks amazing","0","0","157364392135102464",0
"*lick your heart :)","0","0","156122449396764673",0
"Get the EHarmonix HOG and you will never think of the guitar the same again.","0","0","155021808188403713",0
"Track sequencing for the new record. A lot harder than I anticipated.","0","0","152608743341826051",0
"Huggin n Kissin. I think I could give that one a good kick in the pants.","0","0","149590120469774336",0
"Can I get some stems for remixing?","0","0","148865778811281408",0
"Appetite for Destruction almost didn't make it. A year after its release it started to pick up steam. Whoa.","0","0","146477332557864960",0
"That Bon Iver Workout Video Is Real, and It's Part of a Full-Length Fitness DVD (via )","0","0","146287768027402241",0
"Kodak to Graph - Darts EP. Some 19yo kid from the gulf doing gorgeous IDM.","0","0","145193013449195520",0
"Just discovered you. Roommates are going to kill me for playing your record 6 times in a row.","0","0","144835354313236480",0
"In case you forgot about good ol' Sun Kil Moon","0","0","142492936142196737",0
"I am Jack's tear ducts","0","0","141985863839137792",0
"Amazing little stop motion video","0","0","140647843806461952",0
"whoa. How did you see it? Pre screening?","0","0","140634736237346816",0
"is only 24 years old and he's already making music like that?! Gahhhh! FML!","0","0","140634292131860481",0
"HappyBday  My scar from yr party last year healed nicely! Ha!","0","0","138365848237780992",0
"«  At a bar next to The Metro in Chicago »","0","0","138147288597020672",0
"Only took 48 hours to mix the album opener. Y'all gon dig.","0","0","137795580268249088",0
"Starting work on the next album. Listening to a lot of P.M. Dawn lately.","0","0","137310478241234945",0
"Kathleen Hanna on her role in Smells Like Teen Spirit","0","0","137304307795107840",0
"Ha! I have a picture of me in a pink cowboy hat at that same store from 5yrs ago!","0","0","134733284390346754",0
"When you walk into your bar, does this song play?  via","0","0","134722063243018242",0
"Mixing thru Sly Stone's old console...the funk, the decadence, the tension, the lbs of coke in this thing...","0","0","134452114276626432",0
"The burbs are officially the ghetto. Is your hometown the next Williamsburg?","0","0","129069847664537600",0
"Total horse shit. We will never learn. The “very scary” Iranian Terror plot","0","0","124166875172175872",0
"YESSSS!!! Phoenix documentary!!","0","0","123475763000377344",0
"Tribute Video to Steve Jobs -","0","0","121801484349358080",0
"Wiki'ing Dylan. Topped the UK charts but not the US for his first 8yrs, then they invert, topping the US but not UK. US=late to the game.","0","0","121115802685554690",0
"Feist could read/sing the washing instructions on my shirt and make it sound like like poetry. Good Lord.","0","0","121107752771780608",0
"Whoa. This+my mind+my tear ducts = blown","0","0","119304603534770176",0
"Jon Stewart to Republicans: 'Take a Long, Hard Look in the Mirror' -","0","0","118550736127799296",0
"Girl w/ the Dragon Tattoo! YESSSSS","0","0","117096498600214528",0
"this song bangs so hard.","0","0","116774607872212992",0
"Awesome. They have come. So far -","0","0","110961586168012800",0
"w/out Buckley's I would never have listened twice.","0","0","110959239232626689",0
"True Love Waits -","0","0","109666360694542336",0
"Lars Von Trier, you need a day at the beach -","0","0","108988620756619264",0
"Got the new Apparat. Guess What. Yup. Brilliant.","0","0","108780553574166528",0
"poor interns","0","0","108729097739448320",0
"Something good came of Irene. Stunning","0","0","108273668806803456",0
"Fox News: There's a Reason Fox News Keeps Attacking Gawker -","0","0","107167214418935808",0
"I have a new boyfriend: Spotify McPlaylong. What can I get for ten dolla? Any song you waaaant.","0","0","106598311645024257",0
"Uh, I'll take two of these.","0","0","105750741385359360",0
"Been researching KLF. Mind blowing.  via","0","0","103032408688955392",0
"Pitchfork at 15. They grow up so fast.","0","0","103009262418141185",0
"Tommy Hilfiger has a son rapper. Well, it's better than a bucket of vomit.","0","0","102986782416711680",0
"Bon Iver shagged Bronski Beat and begat . Brilliant. On tour now -","0","0","101384406475874304",0
"How the hell did I miss the band Air France?","0","0","101382644071268352",0
"the new Apparat is going to maul.","0","0","100808807428530176",0
"How have I never read this? Amusing, brilliant, and true. How to write a #1 hit.","0","0","100519651779411968",0
"So, Spotify is pretty amazing.","0","0","100499439529107456",0
"lyric ideas for days based off that show. Met him in person twice. I was his bartender.","0","0","100457527048802304",0
"Alright everyone... big announcement coming soon.","0","0","98881460651569152",0
"head of Motown initially rejected Marvin Gaye's 'What's Going On' as 'the worst thing he'd ever heard' -","0","0","98817180006752257",0
"Made my week.  Mariachi Serenades a Beluga Whale","0","0","98796302376247296",0
"I want Timbaland on an MPC as my drummer.","0","0","97528561610665985",0
"yo, what's the soft synth running in the back of 'pumped up kicks'?","0","0","97517748992749569",0
"On listen number 15. Love. It's like PB&amp;J's first release all over again. Foster The People -  via","0","0","96451665502273536",0
"it kills me that he has to wear that stupid flag pin, like we forgot what team he plays for.","0","0","96449570682322944",0
"It's 3am and I'm listening to Boys for Pele...very common 14 years ago, but now I sit at bars and listen to...","0","0","95405502296621057",0
"Whoa! Who the hell is ? -","0","0","94840990866739202",0
""When keeping it real, goes wrong" - McDonald's Manager Accused Of Punching Customer -http://bit.ly/nR5JN1","0","0","94453367539122176",0
"Sorry Drake, you can't use 'fuck that nigga' in the chorus of a ballad and pull it off unless you're Bob Dylan.","0","0","93984618079977473",0
"Grab a warm towel : Apparat has a new release (via )","0","0","92993866994679808",0
"Guys: The Cradle (Deluxe) is today's Amazon Daily Deal . TODAY ONLY our record is just $3.99. Spread the word!","0","0","86812587500634112",0
"Thx  ... the plank photo to (hopefully) end all plank photos.","0","0","86313932125507585",0
"are you interested in producing a record at the end of the summer?","0","0","85981010709331968",0
"real men go noodling.","0","0","85651632838287361",0
"That goes for Kanye, too. There is not enough lube in the world to make 'douche bag' seem comfortable in any chorus...unless it's Ween.","0","0","85649300150960128",0
"I struggle over lyrics and Beyonce sings "I don't know much about algebra but I know 1+1=2". Even for pop this is a horrid line.","0","0","85648876090036224",0
"Happy birthday stud. Miss your face (and your muffin ass).","0","0","85569022594269184",0
"WHHHHOOOOAAA. This changes the way I look at everything...for the worse. How Washed Out samples:","0","0","85397277144911872",0
"a belated thank you","0","0","85227294985158656",0
"Ho Lee Shit. Epic Guitar Rock lives. Hold on to something sturdy. Fucked Up - "Queen Of Hearts"","0","0","83585450131996672",0
"Ha! Awesome! I remember sitting with him while he was working on that track. Look at him now!","0","0","80848200247943169",0
"Sorry, although the tracks behind Drake are amazing, his lyrics and topics are that of a 16yo girl.","0","0","80535383296835584",0
"Katy Perry, you are officially heads above Lady Gaga for the sole reason of not taking yourself seriously.  via","0","0","80368961065189376",0
"@Sievesse Thanks a lot! Though I do hope there are lots of mashups in the future. That means your music is worth mashing!","0","0","80147027140411393",0
"@Sievesse "been around the world and found that only stupid people are breeding"","0","0","79051663461199872",0
"Remember, Tom Cruise may be mad, but he's a mad genius. http://youtu.be/M-q__knBahs","0","0","78926282318028800",0
"Ha! @sievesse got it.   This is how babies are made","0","0","78894085502541824",0
"I really like this guy's blog. Great analysis of life, art and marketing.  Before I Die http://bit.ly/mSp7gM","0","0","78885862116560896",0
"was seaching for Flo Rida and found this mashup. Epic HoLeeShit. I'm afraid to search for more. http://bit.ly/k7YDiz","0","0","78882610037792768",0
"The next Susan Boyle. Korean, orphaned, street kid","0","0","77837593483542528",0
"I'm already crying. New Ewan McGregor movie, Beginners http://youtu.be/rXUFUp6vsxg","0","0","76391394029215744",0
"is a badass. How refreshing amidst the steaming piles of pop shit","0","0","76381877115686912",0
"Practical tips on writing a book from 22 authors, including   editor . http://bit.ly/jQAtkC","0","0","76359276196671488",0
"Versus Prodigy's mind blending build of SmackMyBitchUp. Full construction vid http://youtu.be/eU5Dn-WaElI","0","0","76203781536235520",0
"Hly Shit. Just now realizing DaftPunk's Discovery is basically a remix record. http://youtu.be/MJPdVVOmbz4","0","0","76203429600575488",0
"never seen you off AIM this long, assumed you quit. Almost got my recording budget...stay tuned.","0","0","76167283445207040",0
"you disabled your AIM, huh? Good idea. Now you can double your output. I got dibs on your car when I visit.","0","0","76163631456321536",0
"To struggling, doubtful artists out there, remember this: Steve Albini didn't think Nirvana was any good.","0","0","76142733244379137",0
"All lovers of MyBloodyValentine + JesusnMaryChain must check out  touring US+Canada this month.","0","0","76010566090625024",0
"Finally sitting down with Van Morrison's Astral Week. Way late. So damn good. I wanna sing with reckless abandon too, dammit.","0","0","75217990005702657",0
"ie, find me a Canadian or Australian wife...hell, a husband will work too, as long as he has soft hands.","0","0","74534710159753216",0
"Government subsidies for indie rock bands in Canada, Australia, etc...so unfair when you're a band from America.","0","0","74533982905188352",0
"in London! Fuck yeah! ATL Reprezent!","0","0","74272625479778304",0
"The new masterpiece by Sofia Coppola; Somewhere in Translation --","0","0","74198642726158336",0
"Got my track for the day. Julian Casablanca is a brilliant songwriter. Raw demo of I'll Try Anything Once -","0","0","74190399685672960",0
"what the f&amp;$*!!! That's not a car! That's a piece of art!!!","0","0","73949367651926016",0
"and who the hell plays Texas Hold'em for the Irish Gov't?","0","0","73915650908749824",0
"gotta make up for all the revenue they lost from U2 banking in Holland!","0","0","73915309614039040",0
"The Rapture is coming in the form of . I pray you seek his love. Watch him save souls on Jimmy Fallon -","0","0","73864787242655744",0
"I didn't. Why?","0","0","73857505658273792",0
"Sorry bros, part one wasn't funny in the first place. What a turd. The Hangover Part II review- http://bit.ly/iFNaoF","0","0","73856355445903360",0
"I couldn't be happier with the new trend in indie a la ,,,@animalcollective,etc","0","0","73821908784787456",0
"go watch the others and wilt","0","0","73818485691645952",0
"Who the hell is !?!? Holy Shit! Face double melted.","0","0","73805939580485632",0
"Eminem is worse than Nickelback. It sounds like he's struggling with a shit on this new album. Bros are blasting it at the pool","0","0","73137261012725761",0
"I'm watching a deaf trani dance to Flock of Seagulls. I shit you not. She is happier than half the people I know.","0","0","72556238419935233",0
"Alright, so I wrote off Sleigh Bells because of Infinity Guitars. I was wrong. Oops.","0","0","72394327329996802",0
"Listening to Pisces Iscariot for the first time since 1997.  Whoa.","0","0","72365200749236224",0
"Such a shame. I love Russell Brand. why didn't the critics?  via","0","0","72205886361305089",0
"Mr. Gosling, why can't I let The Notebook go, no matter how good your subsequent performances are?","0","0","72013088777453568",0
"Film editors are going to be cutting montages to Beth/Rest for the next 20 years.","0","0","71440804064927744",0
"Holy shit. Only  could do a Steve Winwood style track and it be absolutely stunning. This man is a genius.","0","0","71438599463251968",0
"Pressing play on the new","0","0","71433273426984960",0
"Adele=breath of fresh air in the top 40. I'll take her over John Mayer all day longtime.","0","0","71287129027772416",0
"Thanks   - btw I'm friends with Max from Selebrities. So glad you guys are working with that strapping young lad","0","0","71136229663588352",0
"For shitssake, can I get an A&amp;R contact  International before the apocalypse?","0","0","71100123437989888",0
"thanks a ton!","0","0","71088262571241472",0
"This trailer will make you want to know this band - Fucked Up http://www.davidcomestolife.com/","0","0","70916833603104769",0
"I refuse to be an angry sentimentalists who would be angry at these teens. Who Are The Beatles? http://bit.ly/jTgBT2","0","0","70909264226566144",0
"I do. You are welcome anytime. Holler when you need anything ATX.","0","0","70741176856231936",0
"Austin's  = Atlanta's   ...need to figure out how to channel that into the next 'black eyes'","0","0","70732991739084802",0
"Raging bicycle and tech boner. This is the coolest gadget I've seen in a while - http://vimeo.com/23544972","0","0","70715007419166720",0
"Holy Shit - I want to be in the pit for this song:: Battles - Ice Cream video (NSFW)  via","0","0","70706512363929600",0
"Love this - Indie's New Guard Celebrate Michael Azerrad's Our Band Could Be Your Life -  http://bit.ly/iqoKSU","0","0","70692537517617152",0
"Why does it blow my mind that Intel puts money into this? Oh, cuz $1million goes 20x as far in alt hipster media.","0","0","70645912715800577",0
"Good Lord. Cannot wait for the 2nd coming/release by Washed Out. New Track - http://bit.ly/kLN5io","0","0","70392658077548545",0
"Try this one. Oh, and go get a moist, warm rag. Washed Out – “Eyes Be Closed” http://bit.ly/kLN5io","0","0","70392132069900288",0
"tell me u've been listening to this for 24hrs straight. You always beat me to tracks. New Washed Out - http://t.opsp.in/ksOu","0","0","70385129490616320",0
"whoa! Fuggin Elbow for real!","0","0","70368450677182464",0
"You should know what you're not seeing when you GOOGLE.  Very important TED talk - http://on.ted.com/9Ehf","0","0","70175465272381440",0
"I gotta know who in the band tweeted that. Epic.","0","0","70047831708278784",0
"Ha! The studio looks great. I'd love to hear what you've been up to!","0","0","69970125368991744",0
"Half of this record should've been on the Pump Up the Volume sndtrk. EMA - Breakfast","0","0","68744038391627776",0
"I totally called this. Congrats! :: Past Life Martyred Saints (via )","0","0","67871524534755328",0
"The Honda ad works, but I really hear that song behind an Army recruitment spot, with shit exploding and dudes climbing things.","0","0","66606814246084608",0
"You want a conspiracy? The royal court planned this for the lulz. Princess Beatrice's Wedding Hat: Birth of a Meme","0","0","64380771066068992",0
"Congrats to Chandler for making it to the US Barista Competition national finals. We be so proud!","0","0","64230063452856321",0
"so excited about this album hitting next week. Out of drugs and need a kick to the chest? Watch this","0","0","64162866785292288",0
"I live here now. Holla!","0","0","63486033806901248",0
"gimme that Ghostly contact so I can get this record out!\nOh, and did you get the last EP?","0","0","63483900336406528",0
"I blush. I'm actually listening to Eyelid right now for aesthetic direction while mulling over my demos.","0","0","63483421934100480",0
"Decided that we're going to open for you when you headline Glastonbury in 2012. Imma start practicing.","0","0","63463018515795968",0
"Why haven't I heard of  a single time until now?","0","0","63448287612633088",0
"Swoll","0","0","58439467719065600",0
"Hey. Guess what. Dismemberment Plan will cure that Top 40 Radio problem you've been struggling with.","0","0","56565524649345024",0
"This is how you do it...a big middle finger personified.  via . I hop","0","0","55939918479884290",0
"Just watched. Whoa.","0","0","55167922162765824",0
"Shit was rough. Lots of little reasons. NYC only loves you if you have money.","0","0","54837455463002112",0
"Whoa! You're in Austin too!? Not Ohio?","0","0","54836876678406144",0
"Oh, and I live in Austin now. Take me out! - Jordan","0","0","54646846127218688",0
"Sexy was never brought back. This guy will do it. New Drake signee. Download his record for free.","0","0","54646556825092096",0
"Just got added to the  lineup with ChainGangof1974, Junkie XL, and Hot Tub. Our set is at 12:30 tonight, Vice Bar, 302 E 6th st.","0","0","49196008747450369",0
"Snowden is proud to be playing SXSW 2011 for the Sea Shepherd folks. 11pm March 17th!  http://kck.st/egMQOd","0","0","43145101429579776",0
": "just through up. What are you doin?"","0","0","41928826053345281",0
"Adele on the Brit awards. I am a puddle. What a delivery.  http://youtu.be/qemWRToNYJY","0","0","41548208010297344",0
"Ringo Deathstarr's album Colour Trip just arrived.  Stop wearing out your JAMC vinyl and spin this record. I recommend laying down first.","0","0","35580396565565440",0
"The new  is a lot like their other albums: AMAZING.","0","0","34835566608515072",0
"I'm eating those tomorrow night! Suck the head?","0","0","33040431549784064",0
"I thought maybe the whole Chet Haze thing was tongue-in-cheek.  I think its probably more dick-in-cheek.","0","0","25807536418463745",0
"A critical reassessment of Kanye's 'My Beautiful Dark Twisted Fantasy': Welcome to our new feature, DOUBLE TAKE http://bit.ly/e8N0tS","0","0","24596963479523328",0
"So yeah, I changed my mind.  The next album is going to be modeled after Erasure.  Kthxbye","0","0","23989127431061504",0
"you've been listening to those Tony Robbins tapes I sent you.","0","0","21458077702164480",0
"Holy Shit. Literally.   's new bar, Church, is absolutely amazing.  This is the new spot in Atlanta.","0","0","21454114206515200",0
"big new year's party in Atlanta.  We're playing 1/21 at Mercury.  We'll have roman candles there too.","0","0","21359845428961280",0
"it's a sign.  Stop pushing yourself so hard, unless of course it's on the new Katy Perry track we're sculpting.","0","0","21279758071369728",0
"they were at my gig. Puke, sequins, people falling through speaker stacks, strippers, fire marshal, oh, and roman candles.","0","0","21279252280246272",0
"","0","0","18890487880491008",0
"yup!  How can we make it happen today?","0","0","16906538375450625",0
"Free pine scented tunes. Old to some, new to others. Spread the word. NoiseTrade Widget http://soc.li/Ys6X5MD","0","0","14844523066691584",0
"Free pine scented tunes.  Old to some, new to others.  Spread the word.  NoiseTrade Widget http://soc.li/Ys6X5MD","0","0","14414919457841152",0
"I love the stage at Glasslands, just not the molten Fires of Hell boiling underneath.  @Glasslands  http://plixi.com/p/59419651","0","0","8364304050946048",0
"talk about the most counterintuitive brand name ever.  This one blinds you with Tobasco and Bengay before it strikes.","0","0","7659732261150720",0
"There's a song here, somewhere.  Wait, 'Sex is on Fire' is already taken.  Dammit! http://plixi.com/p/58958215","0","0","7639808830603265",0
