tweet_content,retweet_count,favourite_count,tweet_id,tweets_Id
"Snowden DJ set and HEAVEN live show @ Glasslands Friday night.  Hear what happens when I drop Aphex Twin and the Shangri Las at the same.","0","0","7199421217382400",0
"hey boo.  Same number for fourteen years.  Holla!!","0","0","4368414005006336",0
"is headlining Mercury Lounge tonight.  If you like Little Dragon and Lykke Li then you want to be there.","0","0","4341660628557824",0
"make sure you have your special Mormon underwear on!!!","0","0","3690985179582465",0
"I think that's the biggest rehearsal space in NAmerica(and the only one with hardwood floors)","0","0","3552426422439936",0
""John Mayer was just here!"...I thought I smelled bullshit.","0","0","3330575825895424",0
"ummm...have you heard of Hall &amp; Oats?","0","0","2257710024228864",0
"I've listened to Meme about 30 times cover to cover..since before 'meme' or 'twitter' existed as terms.  That's what, 6 years?","0","0","771376449323008",0
"Just heard the Trailmix remix of Fleetwoodmax's 'you make lovin fun'...holy funk.  I hear the song in a whole new way now.","0","0","767295513165824",0
"Looking up who did the production on Naughty by Nature's old tracks.  I want my drums to hit like that.","0","0","29687292931",0
"I want every drum sound Prince ever used on a single, easy to use device.  I would also like a Princifier vocal plug in.","0","0","28830879788",0
"This is how easy it is to do music on the interweb.  One simple video explains it all.   via","0","0","28767850849",0
"oh, and follow me.  I wanted to ask you where you cut your record and how it went.  Trying to figure out where to finish mine.","0","0","28758700939",0
"it was two of the guys' first show.  Gotta break 'em in!","0","0","28758268748",0
"loaded in with 4 tons of gear at our CMJ show but she was so worth it.  Lykke Li is getting a bump from my playlist.  Swoon","0","0","28717251798",0
"Headlining Filter Mag party at Pub Assembly, Brooklyn tonight.  Free entry when you RSVP  @ www.filtermagazine.com/cmj","0","0","28414945850",0
"Congratulations Dave and Radhi.  So thankful to have you in our lives.   Blessings for your new life together.  http://plixi.com/p/51257248","0","0","27646047073",0
"Returning to ATL tomorrow night . Word.","0","0","25431718158",0
"Last minute tickets to School of Seven Bells.  Very happy. You must see them when they come through.","0","0","24069208108",0
"Love is the difficult realization that something other than oneself is real - Iris Murdoch","0","0","22503076396",0
"@mattmalpas Weezer kept a notebook with structures of hit songs mapped out.  The bridge is the hardest part of the song to write.","0","0","21760115928",0
"Putting the call out for CMJ.  We want to rock your jorts off.  If you have any friends throwing an event mention us.","0","0","21164957995",0
"should I go to Snowden or Lady Gaga tonight?","0","0","18131780516",0
"Listening to The Bends and noting song structure.  You've no idea how hard it is to do three choruses without a solo somewhere in between.","0","0","16361587049",0
"If you build it (lots of toys) they will come (lots of songs). http://twitpic.com/1rqnaa","0","0","14889441094",0
"Wish some millionaire could sponsor Snowdens new album release  http://www.myspace.com/snowden","0","0","13833952749",0
""Magic everywhere in this bitch" - ICP","0","0","12020500864",0
"New shirt for sale online... http://www.snowden.info/merch.htm","0","0","11435481882",0
"Thanks for the amazing turn out on a Tuesday night Atlanta.","0","0","10628851821",0
"We're playing at The Earl in Atlanta tonight. Hope y'all can make it out. http://www.badearl.com/","0","0","10579023078",0
"Widget button issues? Use the link in the email w/ the download code, or click here. http://tinyurl.com/yzbk49k","0","0","10519679198",0
"New EP @ http://www.myspace.com/snowden","0","0","10508741380",0
"Tiny interview with the loaf. http://tinyurl.com/yccc3cv","0","0","10390861369",0
"We're playing at The Earl in Atlanta this coming Tuesday. Get tickets while you can... http://www.badearl.com/","0","0","10381005889",0
"Sorry.  I got the hack.  Hope you won a prize or found some good p0rn from the bad link they sent to you from my account.","0","0","9588098908",0
"New EP will be avail for donation and download supa soon.  Still working.  Still hunting for money to finish the record.  Makin' it happen.","0","0","9566688220",0
"Wondering if  will come out with a new album soon. Though I'm just fine with the old one on endless loop.","0","0","9255411985",0
"it is impossible for me to hear Snowden's Anti Anti and not have immediate ATL MJQ flashbacks. I need new brooklyn dance buddies.","0","0","8996929242",0
"Option 11! RT  Friends, please read this letter. Info on new record, pre-order, other stuff. http://tinyurl.com/yfxnko6 - CR","0","0","8868196976",0
"In honor of : Snowden – Time Of The Season (Zombies Cover) ♫ http://blip.fm/~keu14","0","0","8689988969",0
"At a youth AA dance.  Such a weird but awesome thing.","0","0","8435950536",0
"New CWK EP is beyond good. Also beyond good? Every cover that Snowden puts to wax.  The Zombies, Fleetwood Mac, Love &amp; Rockets.  You name it","0","0","8048910509",0
"Imma let y'all Finnish, but Poison Cup by M Ward is one of the greatest ballads of all time.  Get on your roof and listen on repeat.","0","0","7324739783",0
"And in case you missed it the first four years, the Snowden Christmas covers for free download.....     http://www.snowden.info/licorice_ep","0","0","6852077802",0
"Snowden on NPR's All Songs Considered holiday playlist http://tinyurl.com/yagrdtz","0","0","6834543521",0
"Snowden holiday oldies - http://tinyurl.com/ylpy2oo","0","0","6540344684",0
"us... at the moment :)","0","0","6020424412",0
"Listening to debut LP from Moderat, one of Thom Yorke's favorite artists. I now know why.  You MUST hear this.","0","0","5581368047",0
"Zombie Snowden wants to eat your brainz.\n http://twitpic.com/mzk5o","0","0","5165376717",0
"One last poke: Download 'New Tales to Tell', the new Love &amp; Rockets tribute featuring a track by yours truly on Amazon for $4 today only.","0","0","5074149554",0
"stereogum.com/decomposed ...  go listen to School of Seven Bells play 'Connjur' stripped down.  Make sure you're sitting down.","0","0","4985890820",0
"I could listen (and have listened) to the title track from The Big Pink's debut album for about 12 straight hours.","0","0","4829691468",0
"Watching Washed Out for the first time.  This record is going to be the next Postal Service.  At least I hope so.  Go listen NOW.","0","0","4722443487",0
"good seeing y'all last night","0","0","4553498443",0
"RT  Download Snowden's recent Love &amp; Rockets cover from the "New Tales To Tell" tribute comp: http://tinyurl.com/yee45o2","0","0","4374970440",0
"With  on his 45th bday.  Thanks for the amazing anti remix and for all of your music AJ.  You are one of God's warriors.","0","0","3949693522",0
"Bout to shoot video on rooftop...being hosed down for 30 mins in 60deg weather.  Yikes  http://twitpic.com/gt8ij","0","0","3812216262",0
"Photo and video shoot on rooftop in upper west side.  About to get soaked with waterhose for 30 mins.  http://twitpic.com/gt7fb","0","0","3812112173",0
"I are live here now!","0","0","3771416082",0
"I will not be intimidated by Protools.  I will simply avoid working with it at all costs.  Hurdle #187 in the completion of this damn thing.","0","0","3771340360",0
"I'm in Brooklyn finishing tracking for the LP as well as an autumn EP.  I am in need of a couch to crash on one or two days a week. - Jordan","0","0","3679882171",0
"Gonna be working at a studio in Sunset Park, Brooklyn for the next few months finishing my record and whoring my services to others.","0","0","3496821079",0
""This year, the time will pass slow, cause I'm wanting you and New York\nmore than you'll ever know."","0","0","3412991221",0
"Love &amp; Rockets tribute we contributed a track to (No Words No More) is available on iTunes now... http://bit.ly/3JDaIt","0","0","2892145742",0
"in Japan?","0","0","2875985316",0
"Bon Iver - when will our honeymoon ever be over?","0","0","2838638295",0
"Hellhole Ratrace by Girls. Becoming slightly obsessed... http://bit.ly/tGvFF","0","0","2678620955",0
"Snowden in the studio = me in nothing but gym shorts.  No A/C and lots of powered up gear is going to make for a very tender Jordan stew.","0","0","2642476986",0
"Thoughts on Cat Power last night... http://bit.ly/tGvFF","0","0","2615489656",0
"Recutting vocs and guitars for one of the first mixes.  Started tracking the EP.  Burned the midnight oil.  Suddenly it's 8am.  Woot","0","0","2582825137",0
"New Dodos album is sick. Great guitar work by the finger picking singer dude.","0","0","2562917769",0
""Middle of a summer night you just go for a ride, and get high... and sing Nina Simone."","0","0","2523505834",0
"Thanks to everyone who came out last night. Hope y'all enjoyed the new stuff. Have a happy 4th!","0","0","2472401938",0
"No Words No More - http://ilike.com/s/9803a","0","0","2445235004",0
"ATL: Please RT,   10 Year Anniversay Friday w/ Sealions | Abby Go Go. Debuting some new Snowden songs.","0","0","2440030941",0
"New song up on our myspace player. Love &amp; Rockets cover for upcoming tribute album. 'No Words No More'... http://www.myspace.com/snowden","0","0","2423281326",0
"Corinne, the hard as f&amp;@k dimeanored bassist of browden, is dancing onstage to Billy Jean","0","0","2416317642",0
"Start July 4th celebrations early  this friday: http://www.twitpic.com/8rgke","0","0","2388993382",0
"snowden needs sun on the chest.  Rooftop pool overlooking smoglanta.  'summertime, and the living is easy' stuck in my head.","0","0","2361510194",0
"Add us to your FF. Spread the Snowden love.  - , , , ,","0","0","2345667438",0
"Tracking drums on Friday.  Chandler is good enough to handle it all in a day.  Start mixing next week.  Mix for approx 2 more years :P","0","0","2307798985",0
"MSTRKRFT and John Legend look strange together.","0","0","2306011666",0
"Low E string tuned all the way down to a B Flat. Somehow Jordan makes it work.","0","0","2304490245",0
"Languishing in the control room.  Drums...only thing out of my hands.  Should've picked drums in elementary school band.","0","0","2244017523",0
"New VISA ad features killer Moody Blues song 'tuesday afternoon'.  Makes me want to go sit in a reverb tank with a clarinet and write.","0","0","2196325178",0
"Dropsonic, the authority on level 11 guitar rock in Atlanta.  Melting my face with tube driven Les Paul riffs right now.","0","0","2161980771",0
"So what's it like to share your name with the most wanted man in the world, ?","4","3","352116306230784001",0
"You MIGHT think that Snowden is in Ecuador.... this is false.\nTOMORROW NIGHT:  w/  at GS!","2","3","349667478982508545",0
"I know you're on teh tour and all, but we miss your tweeterings","3","2","348669571969974272",0
"Tonight's venue in Minneapolis is so much cooler than the usual club setting. Wish all shows were like this","2","5","348608564039925761",0
