tweet_content,retweet_count,favourite_count,tweet_id,tweets_Id
"So what's it like to share your name with the most wanted man in the world, ?","4","3","352116306230784001",0
"You MIGHT think that Snowden is in Ecuador.... this is false.\nTOMORROW NIGHT:  w/  at GS!","2","3","349667478982508545",0
"I know you're on teh tour and all, but we miss your tweeterings","3","2","348669571969974272",0
"Tonight's venue in Minneapolis is so much cooler than the usual club setting. Wish all shows were like this","2","5","348608564039925761",0
"Tonight's venue in Minneapolis is so much cooler than the usual club setting. Wish all shows were like this","0","0","348608564039925761",0
"TONIGHT W/ OPEN BAR - RSVP to the live recording of  performance at","0","0","348489132231770112",0
"1:45am DUI checkpoint in Missouri. Mikey totes dry FTW!","0","0","348339595441733633",0
"Making the incredibly long drive to Lawrence for our show tonight at .","0","0","348157112502861824",0
"Snowden - So Red (Official Video):  via","0","0","347831426110078976",0
"♫ Just Announced: Denver, CO - Jun 20 at Larimer Lounge","0","0","347774111092723712",0
"Hey Denver... we're about to pull into town for tonight at !  RT for a chance to win tix.","0","0","347773636414943233",0
"Sorry for the mistweet... Tour gets a bit exhausting.  Denver tomorrow  Friday in Lawrence!","0","0","347590414624256000",0
"Get down to Bar Delux tonight at 8 for Snowden! With special guests Old Podrida!","0","0","347447902479720450",0
"Philly area... we're playing a special show at The Barbary for the last date of the tour.  Get tickets here:","0","0","347063287118180352",0
"Chicago is a weekend festival... we're playing Sunday.","0","0","347062993336532993",0
"RSVP to the live recording of  performance at  on June 22 here:  Limited spots available.","0","0","346694085970644992",0
"Snowden + Old Podrida perform on Wednesday at Bar Delux! Check them out:","0","0","346721796000739328",0
"","0","0","346721670934962176",0
"Most beautiful rest stop in the world. 4H is selling brownies and sodas. Oh Washington.","0","0","346375883608707072",0
"Friday night  , Soft Shadows, SuckerForLights, The We Shared Milk &amp; lots of :","0","0","346333330914045952",0
"RT : ::TOMORROW:: Snowden+The Courtneys+Library play Rickshaw!","0","0","346087612416663553",0
"Revelation: Quincy jones is the culmination of Steely Dan and Motown","0","0","346196071598411776",0
"Welcoming back the captivating sounds of  to our stage tonight. 7pm doors! &gt;&gt;","0","0","345966193632501760",0
"“: "Watch out for anybody who has an Ovation guitar. That's your clue right there that something bad is about to happen"-KimDeal”","0","0","345990410667175936",0
"we're going to have a very thorough van search when we try to get back into the US.","0","0","345963285209808896",0
"the 'w' is really superfluous anyway.","0","0","345760680735043584",0
"On behalf of Portland, I apologize to  for Hawthorne Theater having you on the marquee as 'Snoden'.","0","0","345757757753925632",0
"PDX... who's ready to pre-game (and post for that matter) tonight for our show at the Hawthorne Theater with ??","0","0","345670291395076099",0
"We're still waiting for you to show up.  Don't let these hoods and zipties go to waste.","0","0","345389475293175809",0
"Is it possible to leave you heart here over and over?","0","0","345366811417665537",0
"// JUNE 16TH \\ Live At Rickshaw +  present  w/  &amp; Library! 19+ // 8:00 PM // $10","0","0","345301560609345536",0
"Grab your tickets for Snowden at Bar Delux on the 19th!","0","0","345316159048011777",0
"SF tonight at  with  and San Jose's ...","0","0","345269671257325568",0
"'s bass from the golden years. Lotta decadence on this piece. Gonna go sterilize now.","0","0","344995437264121856",0
"In and out Burger goes in Yoi's face hole","0","0","344907584517586945",0
"Also if you're coming out to the shows and have a HD camera... please shoot video in 1080 / 24p and send it to us for a compilation!","0","0","344871947450081280",0
"We're playing  w/   and more!  Presented by .  Say hi after the show!","0","0","344871511032725504",0
"tweeted our video last summer. I'll put "LeeLoo+1" on the list tonight","0","0","344869978706673664",0
"Upgrade at the car rental! Can I fit a bass drum in here?","0","0","344646362983456768",0
"I don't think I'll ever get over the liquor in California grocery stores thing","0","0","344628313270153216",0
"// JUNE 16 \\  w/ Library and , who have a brand new video out! Check out Nu Sundae here!","0","0","344541072573227008",0
"Yo! See you in Portland on Friday. This is what we're like","0","0","344562332548096000",0
"arriving around 6pm today if you wanna hang. Surf tomorrow? I gotta find a board","0","0","344548164356960256",0
"Will someone please take me surfing tomorrow near LA?","0","0","344516224375476225",0
"When my album goes platinum I'm going to have a Torchy's taco trailer towed behind the tour bus.","0","0","344175984595062784",0
"CIA/NSA:  Snowden wil be at  on Wednesday.  If you're bringing Secret Service, we'll put up an overflow tent.","0","0","344145559508119553",0
"blows whistle on gov't spying right after the band  releases album called "No One in Control."","0","0","343927643487498240",0
"It's something incredibly important that people should be talking about.  No complaints from our side over sharing a name.","0","0","343917268247400448",0
"Why would you feel bad for us?","0","0","343915156297891840",0
"Heading to Dallas for our show at Threw Links for","0","0","343481704138301440",0
"♫ Today: Dallas, TX - Jun 8 at Three Links","0","0","343458086075371520",0
"thanks so much for coming","0","0","343301356699910145",0
"@girlsdistracted thank you so much for coming out.","0","0","343272449716150272",0
"I'm at Red 7 for Snowden (Austin, TX) w/ 6 others","0","0","343233324564766720",0
"","0","0","343240091751305217",0
"♫ Today: Austin, TX - Jun 7 at Red 7","0","0","343096069158236161",0
"@girlsdistracted doors at at 9:30... We are on at 11:30","0","0","342817631142821888",0
"We're in LA at Bootleg on the 12th if you're there.","0","0","342762610804011008",0
"This just in!! We're DJing the  show tomorrow night ! Pretty Stoked. WIN TIX HERE:","0","0","342760049942339585",0
"We're at Brick &amp; Mortar on the 13th!","0","0","342761079560101889",0
"♫ Today: New Orleans, LA - Jun 6 at Gasa Gasa","0","0","342732945804623873",0
"New Orleans... we're going to be at Gasa Gasa tonight.  Where should we pre-game?","0","0","342703569264336899",0
"♫ Today: Atlanta, GA - Jun 5 at The EARL","0","0","342355149345415168",0
"interview with : . Playing tonight . Tix still avail","0","0","342333150023806977",0
"Babe, I hate to tell you this way, but I slept with someone last night.","0","0","342330357376487424",0
"NOIC is in Amazon's 100 for $5 promotion... grab it while it's on sale!  via","0","0","341699992978862080",0
"RSVP to the live recording of  performance at  on June 22 here:  Limited spots available.","0","0","341677802959020032",0
"rocking  last night.","0","0","341657393710657536",0
"Does the meth'd out Days Inn in east Nash have a twitter handle? If they did I'd rip it a new one.","0","0","341594913579880448",0
"No more  for hotels. Horrid customer service. Moving on to","0","0","341587123159310337",0
"♫ Playing Live: Nashville, TN - Jun 2 at The High Watt","0","0","341273063402377216",0
"Can't wait for  and  tonight at .","0","0","341263429027364864",0
"Does that mean you'll be making it to the show on Wednesday at The EARL?","0","0","341271718561738754",0
"Great show by  last night  - check em out when they visit your hood. Great record, too.","0","0","341220253696671744",0
"♫ Playing Live: Snowden ON TOUR!","0","0","340936220995633152",0
"♫ Just Announced: Vancouver, Canada - Jun 16 at Rickshaw Theater","0","0","340935199963639808",0
"♫ Just Announced: Seattle, WA - Jun 15 at Barboza","0","0","340934715617976322",0
"On our way to DC.  Filming a live video  tonight.  Where does one get a hair cut in DC?!","0","0","340926802925064192",0
"interviews and gives No One In Control 4/5 stars.","0","0","340926621806628867",0
"Next week  is in town . Got your tickets yet?","0","0","340890502884900865",0
"Tonight: Snowden  + Teen Mom  + Golden Looks  --Roof/Bar @ 6pm / Doors @ 7pm...","0","0","340835418989797377",0
"They spinnin! They spiiiinnnniiinnn!","0","0","340704529362341888",0
"Tonight , tomorrow  , and Sunday at .  Come spend your weekend singing along with us.","0","0","340535246397263872",0
"Motown Philly Snowden's in...rentin'a'little east coast van.","0","0","340486022704013312",0
"How you know when a local  office has problems.  They put their own corporate rep on hold for 30 min and then hang up on them.","0","0","340282900018757632",0
"Apparently  was a bad choice for shipping our lighting rig to New York.  Countless calls today and we still can't get them delivered.","0","0","340274210909868032",0
"DC area... Do you have your tickets for  hotel yet?  Last show at DC9 was super fun!","0","0","340193462597062657",0
"TONIGHT: Snowden w/ Isadora. Nasty show  Doors at 930pm","0","0","340150803358683136",0
"Hung out with  on Memorial Day. Think I've spun 'in the city' about 50times since then .","0","0","339971833241686016",0
"Brooklyn: We are playing this Friday May 31   w/  tickets here","0","0","339874248824860672",0
"Thought I was done with this","0","0","339624159271329793",0
"Snow lair, deep beneath the dangerous streets of Wburg.","0","0","339484952246767619",0
"You have no idea...","0","0","339458145871077377",0
"","0","0","338554760703651840",0
"Reactive backlighting for tour =  &gt; audiotocc &gt; modul8 &gt; madmapper &gt; madlight &gt;  color band pix.","0","0","337638058574893056",0
"If you like my cover of Purity Ring's - Fineshrine... go give it a &lt;3 on Hype Machine.","0","0","337601683762851840",0
"Thanks man... are you still in Colorado or are you in California?","0","0","337408816616468481",0
"Well that would be wonderful.  If you want to make it out for one of the shows, let me know.","0","0","337358590149025792",0
"Thanks for the mention Chris!","0","0","337356007435038721",0
"New post: URB Exclusive Premiere - Snowden - Fineshrine (Purity Ring Cover) via our friends","0","0","337236432005496832",0
"...red vinyl makes me even happier!","0","0","337080571194925056",0
"Working on the light show for the tour.","0","0","337063391854215169",0
"The  documentary on Serpents &amp; Snakes came out today.  Go watch the story of Nashville's newest family.","0","0","336898367747653632",0
"just in... tix to see THE LIVING MAY 23, KINNIE STARR JUNE 08, SNOWDEN JUNE 16 all","0","0","335543257230635008",0
"Thanks guys!","0","0","335549295539408897",0
"or maybe it is...","0","0","335138717230567424",0
"Hahahah... that's not Taylor Swift.","0","0","335138664973758464",0
"Check out the teaser for  documentary coming out soon!","0","0","335088819466539008",0
"Thanks for the playlist add (and hello to fellow Austin local )","0","0","334814103195496448",0
"About to head over to  to DJ, drink tequila, and celebrate the record release.  Come hang out at 5pm!","0","0","334387238328745986",0
"Tell your friend we said hi!","0","0","334352634553180160",0
"VIDEO PREMIERE: Fans of horses, hot dudes, watch 's gorgeous 'So Red' video:","0","0","334350921100296192",0
"Snowden DJ set today at 5pm","0","0","334349417517813760",0
"No One In Control has just been released on iTunes!","0","0","334337009504092160",0
"New video for "So Red" just went live over at MTV Buzzworthy!","0","0","334327405407784960",0
"@girlsdistracted 5pm","0","0","334327021813522432",0
"Happy Release Day, ! 'No One In Control' is now available on","0","0","334323556999639041",0
"Austin, come hang out with me tomorrow and drink tequila at Waterloo records while we celebrate the album release!","0","0","334082938310361088",0
"No One In Control comes out tomorrow!","0","0","333975552941772800",0
"New album comes out on Tuesday!","0","0","333077713600524288",0
"Thanks PJ!  We're going to be in SLC on June 19th at Bar Deluxe.  Come out and hang.","0","0","332901398423404544",0
"TODAY @ 1130 PM! Check  listing!     LIVE  &amp;  "Harlum" vid!","0","0","332095391958978561",0
"Tom @ 1130 PM! Check  listing!     LIVE  &amp;  "Harlum" vid!","0","0","331910674731106304",0
"Listen to 's comeback album, No One In Control, one week early","0","0","331858510126149632",0
"The full album No One In Control is now streaming on","0","0","331859028806340608",0
"6/7:   Tickets Here:","0","0","331619751447130113",0
""The terrorists hate our freedoms."","0","0","330724950795227136",0
"we tried... Everything was booked solid.","0","0","328587884040957952",0
"","0","0","328347582852108289",0
"Go listen to the All Songs Considered  premiere of "So Red"  ... Thanks to Robin and Bob!","0","0","326787378570207233",0
"Listen to So Red which just premiered on All Songs Considered.  No One In Control comes out May 14th! So Red","0","0","326781029362831360",0
"Remember Snowden? After a seven-year hiatus, the band picks up right where they left off with "The Beat Comes"","0","0","324641048276107264",0
"My muse is always hanging around my studio.","0","0","323465569435254784",0
"Sometimes u drop an analog synth and u just know ur starting a hit","0","0","322839245448441856",0
"did a gender reassignment of a snippet of "Keep Quiet" for his latest summer makeout jam "So Much."","0","0","321712677145681920",0
"Summer Tour Dates announced over at ...  Go see if we're coming to a city near you.","0","0","320616354111692801",0
"If it's good enough for Courtney...","0","0","320267312198475776",0
"Almost missed this gem by Dan Auerbach. Gorgeous.","0","0","319851125840945152",0
"I added a video to a  playlist  Snowden - So Red (Preview)","0","0","319521783738949635",0
"I added a video to a  playlist  Snowden - The Beat Comes","0","0","319518760555909120",0
"don't recall that quote but that's definitely the case. Getting ready to fry in Austin this summer.","0","0","318643136492613632",0
"that said... I'm sure someone out there has already promo'd a Tanlines vs Marvin Gaye vs Odd Future vs Daft Punk vs Riff Raff mash","0","0","314134233411092480",0
"We have an ever growing list of those words over here.  Trap was just added.","0","0","314133681251958784",0
"AllSaints Presents:  Showcase. Snapping  in Austin, TX ft. Spring 2013.","0","0","312601358677180416",0
"i think four of those butt massages were mine. Hope you enjoyed.","0","0","313751784403382272",0
"Filming a video for  ... Not entirely sure this location is legal, but its amazing... deep in Austin's underbelly","0","0","312059692748771329",0
"Good Lord, I love Andrew WK:","0","0","310162382590730240",0
"Spun  1k+ times since 2003. Thrilled his new project  is getting some love.","0","0","309380792839200770",0
"! ,  opens for  at ! Get tix ,","0","0","307555923931578368",0
"&lt;3 RT : one of my favorite songs of all time.... \n\n ♫ Anti-Anti – Snowden","0","0","307393674172575744",0
"Hey Kevin... we're in Seattle tonight at Barboza if you want to come by.","0","0","307253482052796417",0
"Support the stations that support the bands you love.  If you listen to ... go donate!","0","0","307242011814133760",0
"End this month right by seeing  and  tonight. 8pm doors!","0","0","307226410982981632",0
"we wanted to but  is this weekend and they didn't respond to our requests to jump on the line-up.   This summer!","0","0","306886391143485440",0
"Denver... don't make us use horrible puns because it snowed today.  Get out and sing and dance with us tonight at","0","0","306563789506113536",0
"Damnit I'm excited to see  tonight at . Anyone else?","0","0","306109390350585859",0
""My grandfather got shot in France so that I could not walk on the moving walkway " - Mikey","0","0","306110275466194944",0
"Helpful reminder: Tomorrow night - 8pm - 18+ we are excited to present  w/ Story of the Sea!","0","0","305769090012807169",0
"So pumped to see  &amp;  tonight  ! It's gonna be a killer show!","0","0","305748811408625665",0
"We're at  tonight!  Doors are at 10:30 and we go on at Midnight.  and  tomorrow in Chicago!","0","0","305388772802035712",0
"There was a shooting with fatalities outside of our show at DC9 tonight.  We hope you are all ok. Still trying to figure out what happened.","0","0","305211103019945984",0
"sits down w/ Jordan Jeffares () playing tonite. \nW/  &amp;  9pm $10","0","0","305083703720304640",0
"Hey SoCal people...  Make sure you get your tickets for our show at  on 3/1","0","0","305038057567055872",0
"And we're throwing a SXSW Showcase w/  feat","0","0","305023843351801859",0
"TONIGHT hear  's new single "Keep Quiet" at   Tix &gt;","0","0","304957699173523456",0
"NOT to be missed xx:  at !!!! See you on the dance floor tonight!","0","0","304311191516352512",0
"Sunday we wanna see YOU at JBTV to catch a FREE Live Taping of  - RSVP Here!","0","0","304344696816295938",0
"Win tickets to our show at","0","0","303987795867881472",0
"Chicago... RSVP and be in studio for our JBTV taping on Sunday!","0","0","303978262193897472",0
"Hey, Boston:  kicks off their tour tonight . Can't recommend catching them strongly enough.","0","0","303916224000163840",0
"Philly... have you gotten your tickets for our show at  on 2/20?","0","0","302129749369683968",0
"Tour starts on the 19th in Boston !  See if we're coming to your town and buy tickets at","0","0","301767508438966273",0
"No such thing as a weekend... Live show visual grind time.","0","0","300306753780842496",0
"remember CDs? Put this in your Case Logic!","0","0","300295917112807424",0
"we're here.  Will try to make if back to say hi.  You guys sound great.","0","0","297937330646433793",0
"Aww yeah!","0","0","297919226432352256",0
"Gah! I live in Austin and I wanna see y'all too! Didn't think it would sell out. Hit me if you go out after.","0","0","297911673283567616",0
"In 5-billion yrs the Sun will expand &amp; engulf our orbit as the charred ember that was once Earth vaporizes. Have a nice day.","0","0","294535544719941634",0
"Help us get up the charts on Hype Machine... go like and listen to Snowden - Keep Quiet on","0","0","294153702556700672",0
"Couldn't agree with you more on the entire line of thought.","0","0","293941937768120320",0
"If you're still doing piracy studies while artists get 1 billion YouTube views, you don't understand the world you live in","0","0","293935795092484097",0
"I'm about to head over to that show now!","0","0","293905865600270336",0
"Can't wait to get back to Philly and play with and  and  at !  Tickets:","0","0","293851403934396416",0
"Win tickets to our  show via","0","0","293818578346582016",0
"New single, free remixes from  and , and US tour dates.   and","0","0","293817026718363648",0
":: Elusive Swedish producer  returns with a groove-heavy remix of Snowden's "Keep Quiet":","0","0","293814398512922624",0
"dude...deep dig. I wrote that song 10 years ago. Look how far we've come...oh...one album.","0","0","291949888671989760",0
"Thanks!  Could you dm me please?","0","0","286932669680463873",0
"So stoked to have Snowden () back Sunday, February 24th! Pick up your presale here:","0","0","284039848296333312",0
"@saviYDG Thanks Savi!","0","0","280830093390143489",0
"Hey girl... hey... let's keep it PG for the kids now.","0","0","280162415042260993",0
"A good man is hard to find...","0","0","280162012133212160",0
"I'm pretty sure the lead singer of  is trying to fuck his guitar.","0","0","280125353664606209",0
"More accessible mental health care. Less military grade guns.","0","0","279988098945908736",0
"Revealed!  + PLS PLS to open for  Dec. 15!","0","0","278612136656257025",0
"Uh oh.  First national tour since 2008 is being booked now.  It begins.","0","0","278253210370732032",0
"It's scary that stuff this great never made it to my radar. Bra - Cymande -","0","0","277482038670544897",0
"Thanks!  I'm about to release the second album in Feb.  DM me if you'd like to hear it.","0","0","274938288350064640",0
"love this album! this is one for the car.","0","0","274732879890747392",0
"Well, don't we feel special.","0","0","273271328709173248",0
"@girlsdistracted wait... are we one of your priorities, or should your playlist be our priorities, or should I go play with my dogs?","0","0","273251868426240000",0
"Meanwhile I'm arguing w/Preston on why can't I use paperclips for ornament hooks","0","0","273242455703420928",0
"Hey you're the one that said the word Bieber.  What did you think was going to happen?","0","0","271401321511403521",0
"No stopping until Bieber, Ke$ha, and Tupac make cameos on the next record.","0","0","271376190353317888",0
"Thanks Tyler! RT   have you heard "The Beat Comes" by Snowden? It's an amazing song that should be on Alt Nation.","0","0","271370229471395841",0
"@illcatchjustinb last I checked I was the artist also known as Snowden.  Not to be confused with the mountain or the Target polar bear.","0","0","271149490256371712",0
"Searching twitter for Snowden gives me a glimpse into teens' lives who share the same name.  Sweet Jesus, the drama of life as a 15 yo.","0","0","271026680167006209",0
"This collaboration now has me dreaming of the day I can get a collaboration with .","0","0","270985237448757248",0
"An example of brilliance in musical and cinematic form.  I can only hope of achieving this one day.","0","0","270932738767474688",0
"Couch blocking techniques are really effective at the Snowden house .","0","0","270662711761854464",0
"Vevo put me up as one of their featured artists on their front page!  I'm just sad I'm not right next to Bieber.","0","0","270583297908822016",0
"THANKS!  RT : Sooooo glad to see Snowden still at it, 'The Beat Comes' now playing","0","0","270001253738758145",0
"@nlaureola thanks for singing along.","0","0","268880226887557120",0
"@girlsdistracted yes, I've lived here for a year and a half.","0","0","268810623943602177",0
"@Lemmy_Bruce we will indeed be through LA during the release.","0","0","267057596328992768",0
"Fall in Austin.","0","0","267045178173427712",0
"'s new record is melting ma'face.","0","0","266236972044009472",0
"Also, thank you to the people of Maine, Maryland, Colorado, and Washington.  Thank you for setting a wonderful example for the rest.","0","0","266083860951998464",0
"Congratulations to President Obama... your acceptance speech was nothing short of incredibly moving.","0","0","266083116437884929",0
"East Side Pies, Mexican Coke, movies, and dogs.  Austin's recovery recipe for a weekend of .  Can't wait for next year.","0","0","265636817397747712",0
"my remix for  is still climbing the charts at hypem...#15 in remixes, #45 overall !  give it a &lt;3","0","0","263024159985106944",0
"OK costume contest time!  Send me pictures of your costume and a sign (so I know its you) and the winner will get the single and a t-shirt.","0","0","262307392597921792",0
"si!  Soundcloud y beatport.","0","0","261973975343718400",0
"Thanks for the writeup!  Make sure you check out the original and all the other remixes too.","0","0","261643760365096961",0
"¡Gracias! has escuchado los remixes también?","0","0","261643070246879232",0
"Looking forward to trying out  9 in the studio.","0","0","261529446065008641",0
"bored? Sheeit. You gots some retweeting to do!","0","0","261306705063858176",0
"If you love the Lane 8 remix of The Beat Comes as much as we do go give it a heart on Hype Machine!","0","0","261241624435249152",0
"Thanks for the support guys!","0","0","261163658745348096",0
"artist  debut track "The Beat Comes," is available on","0","0","261160772158234624",0
"Neither am I... trust me.  Album has an official January release date.","0","0","260798312003801089",0
"Big ups to  and  on their new tunes!","0","0","260775224411299840",0
"Horses &amp; Bayonets... the best band name to ever come from a debate knock out.","0","0","260599169188765696",0
""The Beat Comes" and remixes now available exclusively on Beatport! , ,","0","0","260420190410514433",0
"Giorgio Moroder just joined Sound Cloud.  It's like if Johannes Gutenberg started using Tumblr.  Amazing.","0","0","259358331968319488",0
"Here's the link in case you need a little techno and house in your life today.","0","0","258987612881170432",0
"Lunchtime spent watching Dixon play Boiler Room Berlin... apparently he's been playing 's unreleased remix from the new record.","0","0","258986932812529665",0
"@rtc44 It's coming.","0","0","258833576290824193",0
"Finally got my new studio/workspace set up here in Austin.  If you would like remix/covers done feel free to send me stems/samples/tracks.","0","0","258792913461460993",0
"First single, "The Beat Comes," gets an official release on October 22nd with remixes by    and more.","0","0","255862788344406016",0
"turned me into a   fan.","0","0","252841642397138945",0
"Between the wedding last weekend and the fact that I'm remixing this  track right now... I'm feeling kind of emotional y'all :P","0","0","245582260336738304",0
"RT : •  &amp; I are just finishing a BIG remix for .","0","0","248122491036393472",0
"Big props to my boy for his new track/EP!  "Here is Smoke &amp; Jackal's first single 'No Tell'! Enjoy! :","0","0","238673231744208897",0
"Thanks Meghan!  &lt;3","0","0","232574728613801984",0
"My passport was stolen in Chicago.  Without it we can't get into Canada.  Toronto date is postponed till fall.  We will make it up to you.","0","0","230785651178618880",0
"check your DM's","0","0","230437797423611904",0
"Are you in Chicago?","0","0","230424191126618114",0
"Very sad to hear about the death of Bill Doss.  Our condolences to the Elephant 6, Olivia Tremor Control, family, and friends.","0","0","230376664637517824",0
